{
  "surface_kind": "opl_package_payload_manifest.v2",
  "schema_ref": "contracts/opl-framework/package-payload-manifest-v2.schema.json",
  "package_id": "mas",
  "plugin_id": "med-autoscience",
  "package_version": "0.2.12",
  "source_repo": "https://github.com/gaofeng21cn/med-autoscience.git",
  "source_commit": "17056c5d3170d945da89e7ac1499f4f952b5d004",
  "source_root": "plugins/med-autoscience",
  "content_lock": {
    "algorithm": "sha256",
    "canonicalization": "ordered_path_length_file_length_bytes",
    "digest": "sha256:57061366bb1835947074b1d99618d842ccdead3767bffaac4edd2e0a01630180"
  },
  "files": [
    {
      "path": ".codex-plugin/plugin.json",
      "mode": "100644",
      "source_url": "https://raw.githubusercontent.com/gaofeng21cn/med-autoscience/17056c5d3170d945da89e7ac1499f4f952b5d004/plugins/med-autoscience/.codex-plugin/plugin.json",
      "sha256": "sha256:d5a68112ac80bd606d7af775ddd4955599969d7c427f0ead81bdd1616923d3d3"
    },
    {
      "path": "assets/icon.png",
      "mode": "100644",
      "source_url": "https://raw.githubusercontent.com/gaofeng21cn/med-autoscience/17056c5d3170d945da89e7ac1499f4f952b5d004/plugins/med-autoscience/assets/icon.png",
      "sha256": "sha256:59b93bed97259c95ce12f370d39ce8f2665682138755a5afff78a85fc86833da"
    },
    {
      "path": "assets/icon.svg",
      "mode": "100644",
      "source_url": "https://raw.githubusercontent.com/gaofeng21cn/med-autoscience/17056c5d3170d945da89e7ac1499f4f952b5d004/plugins/med-autoscience/assets/icon.svg",
      "sha256": "sha256:d0ba689e3ce511fa219a8712acf04c0ca710803f134ea6d15f127547ee8ff293"
    },
    {
      "path": "skills/med-autoscience/SKILL.md",
      "mode": "100644",
      "source_url": "https://raw.githubusercontent.com/gaofeng21cn/med-autoscience/17056c5d3170d945da89e7ac1499f4f952b5d004/plugins/med-autoscience/skills/med-autoscience/SKILL.md",
      "sha256": "sha256:ec725bd2d99c82e58a28d741805fd708676df4c22479133c85bc020477be035c"
    },
    {
      "path": "skills/med-autoscience/agents/openai.yaml",
      "mode": "100644",
      "source_url": "https://raw.githubusercontent.com/gaofeng21cn/med-autoscience/17056c5d3170d945da89e7ac1499f4f952b5d004/plugins/med-autoscience/skills/med-autoscience/agents/openai.yaml",
      "sha256": "sha256:44d5cd853ff6235a41858681ff6a93e18cba2cb6ab2e6c65608a591251b31c53"
    }
  ]
}
