{
  "surface_kind": "opl_package_payload_manifest.v2",
  "schema_ref": "contracts/opl-framework/package-payload-manifest-v2.schema.json",
  "package_id": "mas",
  "plugin_id": "med-autoscience",
  "package_version": "0.2.17",
  "source_repo": "https://github.com/gaofeng21cn/med-autoscience.git",
  "source_commit": "e806c166a91250bdcc675fafa1078dbb86d0cc15",
  "source_root": "plugins/med-autoscience",
  "content_lock": {
    "algorithm": "sha256",
    "canonicalization": "ordered_path_length_file_length_bytes",
    "digest": "sha256:36a462b1aaf4cd4eba83fb8d9f28c70315cb6f1b273f5d4feaaba5c270ad77fd"
  },
  "files": [
    {
      "path": ".codex-plugin/plugin.json",
      "mode": "100644",
      "source_url": "https://raw.githubusercontent.com/gaofeng21cn/med-autoscience/e806c166a91250bdcc675fafa1078dbb86d0cc15/plugins/med-autoscience/.codex-plugin/plugin.json",
      "sha256": "sha256:e6f8d618acdcea83b697b3e1b695c6f8b9d9c6e8ed84891675766a23f8f2e73f"
    },
    {
      "path": "assets/icon.png",
      "mode": "100644",
      "source_url": "https://raw.githubusercontent.com/gaofeng21cn/med-autoscience/e806c166a91250bdcc675fafa1078dbb86d0cc15/plugins/med-autoscience/assets/icon.png",
      "sha256": "sha256:59b93bed97259c95ce12f370d39ce8f2665682138755a5afff78a85fc86833da"
    },
    {
      "path": "assets/icon.svg",
      "mode": "100644",
      "source_url": "https://raw.githubusercontent.com/gaofeng21cn/med-autoscience/e806c166a91250bdcc675fafa1078dbb86d0cc15/plugins/med-autoscience/assets/icon.svg",
      "sha256": "sha256:d0ba689e3ce511fa219a8712acf04c0ca710803f134ea6d15f127547ee8ff293"
    },
    {
      "path": "skills/med-autoscience/SKILL.md",
      "mode": "100644",
      "source_url": "https://raw.githubusercontent.com/gaofeng21cn/med-autoscience/e806c166a91250bdcc675fafa1078dbb86d0cc15/plugins/med-autoscience/skills/med-autoscience/SKILL.md",
      "sha256": "sha256:4d9466bb5e4bbf51b3c652a674682d25128babd6a18fa60c320c255c5213cd19"
    },
    {
      "path": "skills/med-autoscience/agents/openai.yaml",
      "mode": "100644",
      "source_url": "https://raw.githubusercontent.com/gaofeng21cn/med-autoscience/e806c166a91250bdcc675fafa1078dbb86d0cc15/plugins/med-autoscience/skills/med-autoscience/agents/openai.yaml",
      "sha256": "sha256:af73de29c4d05b76c09d2a500ce54b2e47d0334ac4ee79ed54d2f0fb8fc9108b"
    }
  ]
}
