{
  "surface_kind": "opl_package_payload_manifest.v2",
  "schema_ref": "contracts/opl-framework/package-payload-manifest-v2.schema.json",
  "package_id": "mas",
  "plugin_id": "med-autoscience",
  "package_version": "0.2.16",
  "source_repo": "https://github.com/gaofeng21cn/med-autoscience.git",
  "source_commit": "56c6e238203f915944b00388ccb189d73b45c70e",
  "source_root": "plugins/med-autoscience",
  "content_lock": {
    "algorithm": "sha256",
    "canonicalization": "ordered_path_length_file_length_bytes",
    "digest": "sha256:46e3bcc2ecf0b07b4a1a4c04192c5938d4e6d1d6a70e4a679c9c32d0adb2b0a9"
  },
  "files": [
    {
      "path": ".codex-plugin/plugin.json",
      "mode": "100644",
      "source_url": "https://raw.githubusercontent.com/gaofeng21cn/med-autoscience/56c6e238203f915944b00388ccb189d73b45c70e/plugins/med-autoscience/.codex-plugin/plugin.json",
      "sha256": "sha256:9f9e000f64288ce308b6925dd08bb4cd8dcc4210ecdf56389e1e1179d1007e09"
    },
    {
      "path": "assets/icon.png",
      "mode": "100644",
      "source_url": "https://raw.githubusercontent.com/gaofeng21cn/med-autoscience/56c6e238203f915944b00388ccb189d73b45c70e/plugins/med-autoscience/assets/icon.png",
      "sha256": "sha256:59b93bed97259c95ce12f370d39ce8f2665682138755a5afff78a85fc86833da"
    },
    {
      "path": "assets/icon.svg",
      "mode": "100644",
      "source_url": "https://raw.githubusercontent.com/gaofeng21cn/med-autoscience/56c6e238203f915944b00388ccb189d73b45c70e/plugins/med-autoscience/assets/icon.svg",
      "sha256": "sha256:d0ba689e3ce511fa219a8712acf04c0ca710803f134ea6d15f127547ee8ff293"
    },
    {
      "path": "skills/med-autoscience/SKILL.md",
      "mode": "100644",
      "source_url": "https://raw.githubusercontent.com/gaofeng21cn/med-autoscience/56c6e238203f915944b00388ccb189d73b45c70e/plugins/med-autoscience/skills/med-autoscience/SKILL.md",
      "sha256": "sha256:4f311ef6c3bbaf74bb5ad723cae2dd6075c1c7d17fc7a4a531acb75f21fa627e"
    },
    {
      "path": "skills/med-autoscience/agents/openai.yaml",
      "mode": "100644",
      "source_url": "https://raw.githubusercontent.com/gaofeng21cn/med-autoscience/56c6e238203f915944b00388ccb189d73b45c70e/plugins/med-autoscience/skills/med-autoscience/agents/openai.yaml",
      "sha256": "sha256:af73de29c4d05b76c09d2a500ce54b2e47d0334ac4ee79ed54d2f0fb8fc9108b"
    }
  ]
}
