{
  "surface_kind": "opl_package_payload_manifest.v2",
  "schema_ref": "contracts/opl-framework/package-payload-manifest-v2.schema.json",
  "package_id": "rca",
  "plugin_id": "redcube-ai",
  "package_version": "0.2.7",
  "source_repo": "https://github.com/gaofeng21cn/redcube-ai.git",
  "source_commit": "c10ad7e198b10cd3491ff43343b50fe1d6f11c74",
  "source_root": "plugins/redcube-ai",
  "content_lock": {
    "algorithm": "sha256",
    "canonicalization": "ordered_path_length_file_length_bytes",
    "digest": "sha256:896ee685fbde69afd960b0128ddf7376bb554228a3dc1fc7519a1eb66fa8dc18"
  },
  "files": [
    {
      "path": ".codex-plugin/plugin.json",
      "mode": "100644",
      "source_url": "https://raw.githubusercontent.com/gaofeng21cn/redcube-ai/c10ad7e198b10cd3491ff43343b50fe1d6f11c74/plugins/redcube-ai/.codex-plugin/plugin.json",
      "sha256": "sha256:14885e033ea654e7427b09919501f99f2ddbda71754c3f288036dda5caea33d9"
    },
    {
      "path": "assets/icon.png",
      "mode": "100644",
      "source_url": "https://raw.githubusercontent.com/gaofeng21cn/redcube-ai/c10ad7e198b10cd3491ff43343b50fe1d6f11c74/plugins/redcube-ai/assets/icon.png",
      "sha256": "sha256:e599c03713aed9f8d7f88047e8d3845062da3d6a9ee073f33a0010ecac8dff5e"
    },
    {
      "path": "skills/redcube-ai/SKILL.md",
      "mode": "100644",
      "source_url": "https://raw.githubusercontent.com/gaofeng21cn/redcube-ai/c10ad7e198b10cd3491ff43343b50fe1d6f11c74/plugins/redcube-ai/skills/redcube-ai/SKILL.md",
      "sha256": "sha256:16b52b7e6f430a1d899530bab773d0ecdaace543df8b636c4135cca2e4de967e"
    },
    {
      "path": "skills/redcube-ai/agents/openai.yaml",
      "mode": "100644",
      "source_url": "https://raw.githubusercontent.com/gaofeng21cn/redcube-ai/c10ad7e198b10cd3491ff43343b50fe1d6f11c74/plugins/redcube-ai/skills/redcube-ai/agents/openai.yaml",
      "sha256": "sha256:35a48d0940a50f7a8543844a108d99d58e139c6afa96e865d93d98c253347049"
    }
  ]
}
