{
  "surface_kind": "opl_package_payload_manifest.v2",
  "schema_ref": "contracts/opl-framework/package-payload-manifest-v2.schema.json",
  "package_id": "oma",
  "plugin_id": "opl-meta-agent",
  "package_version": "0.4.1",
  "source_repo": "https://github.com/gaofeng21cn/opl-meta-agent.git",
  "source_commit": "7e7a347f2af701138e22ef7b0385059990eea7fa",
  "source_root": "plugins/opl-meta-agent",
  "content_lock": {
    "algorithm": "sha256",
    "canonicalization": "ordered_path_length_file_length_bytes",
    "digest": "sha256:cd6c5fa27b5d9d52d9702f2a306694c839913154483a58c0c780c7ddded8b79f"
  },
  "files": [
    {
      "path": ".codex-plugin/plugin.json",
      "mode": "100644",
      "source_url": "https://raw.githubusercontent.com/gaofeng21cn/opl-meta-agent/7e7a347f2af701138e22ef7b0385059990eea7fa/plugins/opl-meta-agent/.codex-plugin/plugin.json",
      "sha256": "sha256:a12c2122d22e5265a4e455b657aed0593b847e56a0efad27b4e1381e5e6b6d57"
    },
    {
      "path": "assets/icon.svg",
      "mode": "100644",
      "source_url": "https://raw.githubusercontent.com/gaofeng21cn/opl-meta-agent/7e7a347f2af701138e22ef7b0385059990eea7fa/plugins/opl-meta-agent/assets/icon.svg",
      "sha256": "sha256:c8513ae10777203b9f9d689f893c9c18944bcf76b68128d89fadef165c2c1a55"
    },
    {
      "path": "skills/opl-meta-agent/SKILL.md",
      "mode": "100644",
      "source_url": "https://raw.githubusercontent.com/gaofeng21cn/opl-meta-agent/7e7a347f2af701138e22ef7b0385059990eea7fa/plugins/opl-meta-agent/skills/opl-meta-agent/SKILL.md",
      "sha256": "sha256:90f63f5732ec944ebe6bd64909d92855650b99cd2e93ab9c8c23e843aff380b1"
    }
  ]
}
