{
  "surface_kind": "opl_package_payload_manifest.v2",
  "schema_ref": "contracts/opl-framework/package-payload-manifest-v2.schema.json",
  "package_id": "oma",
  "plugin_id": "opl-meta-agent",
  "package_version": "0.3.7",
  "source_repo": "https://github.com/gaofeng21cn/opl-meta-agent.git",
  "source_commit": "240318b3b0c4980eb4193fb02a7e1f9c9ea7bd7c",
  "source_root": "plugins/opl-meta-agent",
  "content_lock": {
    "algorithm": "sha256",
    "canonicalization": "ordered_path_length_file_length_bytes",
    "digest": "sha256:2deb9ed8d2c83003556244456cc452ea0a96f3fc65894d3f5a78d03006ff5de3"
  },
  "files": [
    {
      "path": ".codex-plugin/plugin.json",
      "mode": "100644",
      "source_url": "https://raw.githubusercontent.com/gaofeng21cn/opl-meta-agent/240318b3b0c4980eb4193fb02a7e1f9c9ea7bd7c/plugins/opl-meta-agent/.codex-plugin/plugin.json",
      "sha256": "sha256:053e17d601ef73fc38605e154fd5a10fe1fe2428367f2ab130ae4eb58ecb3a9e"
    },
    {
      "path": "assets/icon.svg",
      "mode": "100644",
      "source_url": "https://raw.githubusercontent.com/gaofeng21cn/opl-meta-agent/240318b3b0c4980eb4193fb02a7e1f9c9ea7bd7c/plugins/opl-meta-agent/assets/icon.svg",
      "sha256": "sha256:c8513ae10777203b9f9d689f893c9c18944bcf76b68128d89fadef165c2c1a55"
    },
    {
      "path": "skills/opl-meta-agent/SKILL.md",
      "mode": "100644",
      "source_url": "https://raw.githubusercontent.com/gaofeng21cn/opl-meta-agent/240318b3b0c4980eb4193fb02a7e1f9c9ea7bd7c/plugins/opl-meta-agent/skills/opl-meta-agent/SKILL.md",
      "sha256": "sha256:ee70512b845bb918df9216cc1c8143416b98a34f9904aad1ea624ce6991faeec"
    }
  ]
}
